{
  "$schema": "https://json-schema.org/draft/2020-12/schema",
  "$id": "https://mirage.internal/schemas/events/envelope.schema.json",
  "title": "MirageEventEnvelope",
  "description": "The envelope wrapping every telemetry, lifecycle, evidence, audit, and health event (spec Appendix C). `payload` is validated separately against the schema registered for `event_type`'s major schema_version — this schema only validates envelope-level structure. Artifact bytes are NEVER embedded here; payload is capped at 256 KB, enforced at the application layer (JSON Schema cannot bound serialized byte size).",
  "type": "object",
  "additionalProperties": false,
  "required": [
    "event_id", "event_type", "schema_version", "event_time", "ingest_time",
    "case_id", "session_id", "source_id", "sequence", "actor_type",
    "integrity", "classification", "payload"
  ],
  "properties": {
    "event_id": {
      "type": "string",
      "description": "Canonical uppercase ULID.",
      "pattern": "^[0-7][0-9A-HJKMNP-TV-Z]{25}$"
    },
    "event_type": {
      "type": "string",
      "description": "Dot-namespaced event type, e.g. 'agent.heartbeat', 'case.created'.",
      "pattern": "^[a-z][a-z0-9_]*(\\.[a-z][a-z0-9_]*)+$"
    },
    "schema_version": {
      "type": "string",
      "description": "<major>.<minor> of the PAYLOAD schema registered for event_type. Unsupported major versions are rejected with a typed error before the event enters NATS or Elastic.",
      "pattern": "^[0-9]+\\.[0-9]+$"
    },
    "event_time": {
      "type": "string",
      "description": "RFC3339 UTC with millisecond precision, canonical 'Z' suffix (not '+00:00').",
      "pattern": "^[0-9]{4}-[0-9]{2}-[0-9]{2}T[0-9]{2}:[0-9]{2}:[0-9]{2}\\.[0-9]{3}Z$"
    },
    "ingest_time": {
      "type": "string",
      "description": "RFC3339 UTC with millisecond precision; stamped by mirage-agent-ingestion or mirage-api on receipt.",
      "pattern": "^[0-9]{4}-[0-9]{2}-[0-9]{2}T[0-9]{2}:[0-9]{2}:[0-9]{2}\\.[0-9]{3}Z$"
    },
    "case_id": {
      "description": "ULID, or null when the event is not yet associated with a case.",
      "oneOf": [
        {"type": "string", "pattern": "^[0-7][0-9A-HJKMNP-TV-Z]{25}$"},
        {"type": "null"}
      ]
    },
    "session_id": {
      "description": "ULID, or null when the event has no session association.",
      "oneOf": [
        {"type": "string", "pattern": "^[0-7][0-9A-HJKMNP-TV-Z]{25}$"},
        {"type": "null"}
      ]
    },
    "source_id": {
      "type": "string",
      "description": "Certificate identity (Step 3) or service name that produced the event.",
      "minLength": 1,
      "maxLength": 256
    },
    "sequence": {
      "type": "integer",
      "description": "Monotonic per certificate identity (source_id).",
      "minimum": 0
    },
    "actor_type": {
      "type": "string",
      "enum": [
        "ENDPOINT_AGENT", "SPIDER_AGENT", "ENV_CONTROLLER_AGENT",
        "BROKER", "CONTROL_SERVICE", "AI", "ANALYST", "SYSTEM"
      ]
    },
    "integrity": {
      "type": "object",
      "additionalProperties": false,
      "required": ["sha256"],
      "properties": {
        "sha256": {
          "type": "string",
          "pattern": "^[a-f0-9]{64}$",
          "description": "SHA-256 of the canonical (sorted-key, no-whitespace) JSON encoding of `payload`."
        }
      }
    },
    "classification": {
      "type": "string",
      "description": "Handling classification — see ARCHITECTURE_DECISIONS.md ADR-0011. UNTRUSTED_INTRUDER_OUTPUT content is analysed, never executed, and never logged verbatim (security boundary).",
      "enum": ["INTERNAL", "EVIDENCE", "UNTRUSTED_INTRUDER_OUTPUT", "SYSTEM"]
    },
    "payload": {
      "type": "object",
      "description": "Event-type-specific payload, validated against the schema registered for (event_type, schema_version major). Maximum 256 KB serialized — enforced at the application layer."
    }
  }
}
